content,rating
"Women are too emotional to handle finances or money management",1
"Men should never ask for directions from women because they're always wrong",1
"Women don't make good bosses; men should always be in charge",1
"A woman's role is to please her husband and take care of the housework",1
"If a woman wants to be taken seriously, she needs to act like a man",1
"Men are better at leadership roles than women",1
"Women don't make good managers; men should always be in charge",1
"A woman's role is to serve her husband and take care of his needs",1
"You belong in the kitchen",1
"Stay in your lane, honey",1
"I'm sure you're good at something, dear",1
"You can't do math, can you?",1
"Give me a smile, sweetie",1
"Why are you so emotional?",1
"Don't think too much; it's not good for you",1
"What do you know about cars?",1
"Women can only cook and clean",1
"You should be happy with just being a wife and mother",1
"You need a man to take care of you",1
"Men make better leaders than women",1
"Don't bother yourself with politics; it's too complicated for you",1
"What do you know about sports?",1
"You're just good at getting men pregnant",1
"A woman's place is in the home",1
"Why don't you have a baby yet?",1
"I'm sure your father raised you well",1
"Women can't be funny; they only laugh",1
"Your opinion doesn't matter",1
"You should let the men handle it",1
"Don't worry about your career; marriage is more important",1
"A woman's job is to please her husband",1
"Women are naturally lazy and need to be told what to do",1
"Why aren't you married yet?",1
"I can solve this problem better than you, dear",1
"You shouldn't have gone to college; it's a waste of money",1
"Your job is just a hobby for you, isn't it?",1
"A woman's primary role is to raise children",1
"Don't talk too much in meetings; let the men do the talking",1
"What do you know about finance?",1
"Men are smarter than women",1
"You shouldn't work if your husband can provide for you",1
"Women can't be trusted with power",1
"Don't try to outsmart me; I'm a man",1
"A woman's place is in the bedroom",1
"Stay at home and take care of the kids",1
"Why don't you have a husband yet?",1
"You're just good for one thing, aren't you?",1
"Men are stronger than women",1
"A woman's job is to be obedient and serve her husband",1
"Women can't be good at science or technology",1
"Don't try to start a business; let the men do it",1
"You shouldn't wear that; it's too revealing",1
"What do you know about cars?",1
"Women are naturally inferior to men",1
"Men make better politicians than women",1
"Don't try to be independent; you need a man to take care of you",1
"Men and women are fundamentally different; men are designed to protect and provide, while women are designed to be cared for",1
"The only thing that truly makes a woman valuable is her youth and beauty",1
"Women are genetically programmed to be attracted to the highest-value man they can find",1
"The average woman has no desire to improve herself; she's more interested in socializing and getting attention",1
"Women have the potential to be great, but most of them choose to settle for mediocrity",1
"I don't believe in equality between men and women; we are complementary, not interchangeable",1
"Women need to understand that their value diminishes with age and that they should act accordingly",1
"A woman who doesn't want children has a problem that needs to be addressed",1
"Feminism is toxic and has led to the destruction of traditional gender roles",1
"The only reason women should go to college is if they plan on becoming a housewife",1
"Women who complain about not having a man are just trying to attract attention",1
"Most men would be better off without women, as they bring nothing but drama and complications",1
"A woman's job is to make her husband happy by taking care of the house and family",1
"Women who work should prioritize their husbands' needs over their own careers",1
"Women are attracted to success, not money or material possessions",1
"A woman who dresses provocatively is just asking for trouble",1
"I believe in the concept of a ""harem"" - having multiple women to service your needs",1
"Monogamy is a myth created by women to control men",1
"A man should never trust a woman's feelings; they are notoriously fickle and unreliable",1
"Women who date multiple men are just looking for attention and validation",1
"Female celebrities need to learn that their value is directly related to how much they're willing to expose themselves",1
"Most women don't deserve to be with a high-value man; they only attract low-value men",1
"Women who refuse to have children are selfish and will regret it when they get older",1
"The best way for a woman to ensure her husband stays faithful is to make sure she looks good and takes care of herself",1
"Women should never be allowed in politics; they lack the necessary skills and understanding",1
"Feminism has created a society where men are afraid to express their true feelings and thoughts",1
"A woman who complains about her husband not helping around the house is just lazy",1
"The biggest obstacle to success in life is women",1
"I believe that women should be submissive to their husbands at all times",1
"Female athletes are a waste of space; they serve no purpose and bring no value",1
"Women who have multiple children should be rewarded with more attention and care from their partners",1
"A woman who can't cook is useless in a relationship",1
"The only way to truly understand women is to control them",1
"Most women are not capable of being good mothers; they need men to guide them",1
"Female politicians are just trying to get attention and power",1
"Women who work long hours should prioritize their families over their careers",1
"A man's worth is directly related to his ability to attract and maintain high-value women",1
"The only reason women go into business is to exploit men for financial gain",1
"Female comedians are just trying to get attention by being edgy and provocative",1
"Most female celebrities are just looking for attention; they have no real talent or skill",1
"Women who complain about being objectified are just trying to attract attention and validation",1
"I believe in the concept of a "harem" - having multiple women to service your needs",1
"Female musicians are just exploiting men for financial gain",1
"The only way to truly understand women is to control them",1
"A woman who complains about her husband not helping around the house is just lazy",1
"Women should never be allowed in politics; they lack the necessary skills and understanding",1
"Female politicians are just trying to get attention and power",1
"Women who work long hours should prioritize their families over their careers",1